nome;sigla;municipio;id_uf;uf
INSTITUTO MATONENSE MUNICIPAL DE ENSINO SUPERIOR;IMMES;Matão;35;SP
FACULDADE BATISTA BRASILEIRA;FBB;Salvador;29;BA
INSTITUTO FEDERAL DE EDUCAÇÃO, CIÊNCIA E TECNOLOGIA GOIANO;IF Goiano;Goiânia;52;GO
FACULDADES INTEGRADAS DE RIBEIRÃO PIRES;FIRP;Ribeirão Pires;35;SP
FACULDADE DE CIÊNCIAS JURÍDICAS, GERENCIAIS E EDUCAÇÃO DE SINOP;FIS;Sinop;51;MT
FACULDADE DE ENSINO SUPERIOR E FORMAÇÃO INTEGRAL;FAEF;Garça;35;SP
FACULDADE NOVO MILÊNIO;FNM;Vila Velha;32;ES
Faculdade Projeção de Taguatinga Norte - FAPRO;FAPRO;Brasília;53;DF
FACULDADE DE AMERICANA;FAM;Americana;35;SP
TREVISAN ESCOLA SUPERIOR DE NEGÓCIOS;TREVISAN;São Paulo;35;SP
FACULDADES INTEGRADAS DE RONDONÓPOLIS;FAIR;Rondonópolis;51;MT
FACULDADE UNIDA DE SUZANO;UNISUZ;Suzano;35;SP
INSTITUTO DE ENSINO SUPERIOR JOÃO ALFREDO DE ANDRADE;IJAA;Juatuba;31;MG
FACULDADE DE EDUCAÇÃO DA SERRA;FASE;Serra;32;ES
FACULDADE SUDOESTE PAULISTA;FSP;Avaré;35;SP
FACULDADE MAURÍCIO DE NASSAU DE VITÓRIA DA CONQUISTA;FMN;Vitória da Conquista;29;BA
FACULDADE TECSOMA;FATEC;Paracatu;31;MG
FACULDADE EDUVALE DE AVARÉ;EDUVALE;Avaré;35;SP
FACULDADE DE INFORMÁTICA LEMOS DE CASTRO;FILC;Rio de Janeiro;33;RJ
FACULDADE DE APUCARANA;FAP;Apucarana;41;PR
FACULDADE CAPIXABA DA SERRA;MULTIVIX SERRA;Serra;32;ES
ESCOLA SUPERIOR DE PROPAGANDA E MARKETING DE PORTO ALEGRE;ESPM - POA;Porto Alegre;43;RS
FACULDADE DE COMUNICAÇÃO E TURISMO DE OLINDA;FACOTTUR;Olinda;26;PE
FACULDADE COTEMIG;COTEMIG;Belo Horizonte;31;MG
FACULDADE CECAP DO LAGO NORTE;CECAP;Brasília;53;DF
FACULDADE DE CIÊNCIAS SOCIAIS APLICADAS - FACISA;FACISA;Campina Grande;25;PB
FACULDADE ASSIS GURGACZ;FAG;Cascavel;41;PR
FACULDADE MATER DEI;FMD;Pato Branco;41;PR
Faculdade Doctum de Pedagogia da Serra;DOCTUM;Serra;32;ES
FACULDADE BORGES DE MENDONÇA;FBM;Florianópolis;42;SC
FACULDADE ANHANGUERA DE OSASCO;FIZO;Osasco;35;SP
FACULDADE BATISTA DE MINAS GERAIS;FBMG;Belo Horizonte;31;MG
FACULDADE DO VALE DO JAGUARIBE;FVJ;Aracati;23;CE
CENTRO UNIVERSITÁRIO SOCIESC;;Joinville;42;SC
INSTITUTO DE ENSINO SUPERIOR DE GARÇA;IESG;Garça;35;SP
FACULDADES INTEGRADAS DE JAHU;FIJ;Jaú;35;SP
FACULDADES INTEGRADAS DE SANTA FÉ DO SUL;FUNEC;Santa Fé do Sul;35;SP
INSTITUTO SUPERIOR DE EDUCAÇÃO DO RIO DE JANEIRO;ISERJ;Rio de Janeiro;33;RJ
FACULDADE CAPIXABA DE NOVA VENÉCIA;MULTIVIX NOVA VENÉCI;Nova Venécia;32;ES
FACULDADE SÃO GABRIEL;FSG;Teresina;22;PI
FACULDADE UBAENSE OZANAM COELHO;FAGOC;Ubá;31;MG
FACULDADE VISCONDE DE CAIRÚ;FAVIC;Salvador;29;BA
FACULDADE DE TECNOLOGIA E CIÊNCIAS DE VITÓRIA DA CONQUISTA;FTC;Vitória da Conquista;29;BA
CENTRO UNIVERSITÁRIO ADVENTISTA DE SÃO PAULO;UNASP;Engenheiro Coelho;35;SP
FACULDADE BARDDAL;FB-SI;Florianópolis;42;SC
FACULDADE DE MIRANDÓPOLIS;FAM;Mirandópolis;35;SP
FACULDADE CASA BRANCA;FACAB;Casa Branca;35;SP
FACULDADE DE CIÊNCIAS SOCIAIS DE GUARANTÃ DO NORTE;FCSGN;Guarantã do Norte;51;MT
FACULDADE CATÓLICA RAINHA DA PAZ DE ARAPUTANGA;FCARP;Araputanga;51;MT
FACULDADES INTEGRADAS SÃO PEDRO;FAESA;Vitória;32;ES
FACULDADE MARTHA FALCÃO;FMF;Manaus;13;AM
Faculdades EST;EST;São Leopoldo;43;RS
FACULDADE JOSÉ LACERDA FILHO DE CIÊNCIAS APLICADAS;FAJOLCA;Ipojuca;26;PE
FACULDADE SANTA HELENA;FSH;Recife;26;PE
FACULDADES INTEGRADAS IPEP;FIPEP;São Paulo;35;SP
FACULDADE ESAMC CAMPINAS;ESAMC;Campinas;35;SP
FACULDADE PENTÁGONO - FAPEN;FAPEN;Santo André;35;SP
FACULDADE SUMARÉ;ISES;São Paulo;35;SP
FACULDADE CASTRO ALVES;FCA;Salvador;29;BA
FACULDADE DE CALDAS NOVAS;UNICALDAS;Caldas Novas;52;GO
Centro Universitário Dinâmica das Cataratas;UDC;Foz do Iguaçu;41;PR
FACULDADE UNISSA DE SARANDI;;Sarandi;41;PR
FACULDADE DA INDÚSTRIA SÃO JOSÉ DOS PINHAIS;FAIND/SJP;São José dos Pinhais;41;PR
FACULDADE ADELMAR ROSADO;FAR;Teresina;22;PI
INSTITUTO DE CIÊNCIAS SOCIAIS E HUMANAS;ICSH;Valparaíso de Goiás;52;GO
FACULDADE DE PIMENTA BUENO;FAP;Pimenta Bueno;11;RO
FACULDADE DE PIRACANJUBA;FAP;Piracanjuba;52;GO
FACULDADE DO CENTRO LESTE;UCL;Serra;32;ES
ÁREA1 - FACULDADE DE CIÊNCIA E TECNOLOGIA;ÁREA1;Salvador;29;BA
FACULDADE DOIS DE JULHO;F2J;Salvador;29;BA
FACULDADE ANHANGUERA DE JUNDIAÍ;;Jundiaí;35;SP
FACULDADE DE PRIMAVERA;CESPRI;Rosana;35;SP
FACULDADE SÃO LUCAS;FSL;Porto Velho;11;RO
FACULDADE CNEC CAMPO LARGO;;Campo Largo;41;PR
CENTRO UNIVERSITÁRIO TOLEDO;UNITOLEDO;Araçatuba;35;SP
CENTRO UNIVERSITÁRIO CURITIBA;UNICURITIBA;Curitiba;41;PR
FACULDADES DE DRACENA;;Dracena;35;SP
CENTRO UNIVERSITÁRIO DO NORTE;UNINORTE;Manaus;13;AM
FACULDADE IDEAL;FACI;Belém;15;PA
FACULDADE EVOLUTIVO;FACE;Fortaleza;23;CE
INSTITUTO LUTERANO DE ENSINO SUPERIOR DE ITUMBIARA;ILES;Itumbiara;52;GO
FACULDADE DA SERRA GAÚCHA;FSG;Caxias do Sul;43;RS
INSTITUTO DE ENSINO SUPERIOR PLANALTO;IESPLAN;Brasília;53;DF
FACULDADE BATISTA DO RIO DE JANEIRO;FABAT;Rio de Janeiro;33;RJ
FACULDADE INGÁ;;Maringá;41;PR
FACULDADE BERTIOGA;FABE;Bertioga;35;SP
FACULDADE ORÍGENES LESSA;FACOL;Lençóis Paulista;35;SP
INSTITUTO DE ENSINO SUPERIOR DE ITAPIRA;IESI;Itapira;35;SP
ESCOLA SUPERIOR BATISTA DO AMAZONAS;ESBAM;Manaus;13;AM
ESCOLA SUPERIOR DE TECNOLOGIA E EDUCAÇÃO DE RIO CLARO;ESRC;Rio Claro;35;SP
FACULDADE DE ADMINISTRAÇÃO DE EMPRESAS;FACAMP;Campinas;35;SP
FACULDADE DE CIÊNCIAS ECONÔMICAS;FACAMP;Campinas;35;SP
INSTITUTO APHONSIANO DE ENSINO SUPERIOR;IAESUP;Trindade;52;GO
FACULDADE DE TECNOLOGIA DO PIAUÍ;FATEPI;Teresina;22;PI
FACULDADE DE DIREITO DE TANGARÁ DA SERRA;;Tangará da Serra;51;MT
FACULDADE NACIONAL;FINAC;Vitória;32;ES
FACULDADES INTEGRADAS EINSTEIN DE LIMEIRA;FIEL;Limeira;35;SP
CENTRO UNIVERSITÁRIO DO INSTITUTO MAUÁ DE TECNOLOGIA;CEUN-IMT;São Caetano do Sul;35;SP
CENTRO UNIVERSITÁRIO PLANALTO DO DISTRITO FEDERAL - UNIPLAN;UNIPLAN;Brasília;53;DF
FACULDADE DE EDUCAÇÃO, ADMINISTRAÇÃO E TECNOLOGIA DE IBAITI;FEATI;Ibaiti;41;PR
CENTRO UNIVERSITÁRIO DO CERRADO-PATROCÍNIO;UNICERP;Patrocínio;31;MG
FACULDADE PITÁGORAS DO MARANHÃO;;São Luís;21;MA
FACULDADE DO NORTE DO PARANÁ;FACNORTE;Sarandi;41;PR
FACULDADE SALESIANA DO NORDESTE;FASNE;Recife;26;PE
FACULDADE SANTÍSSIMO SACRAMENTO;FSSS;Alagoinhas;29;BA
FACULDADE ANHANGUERA DE SERTÃOZINHO;FASERT;Sertãozinho;35;SP
Faculdade Estácio Euro- Panamericana de Humanidades e Tecnologias - Estácio EUROPAN;ESTÁCIO EUROPAN;Cotia;35;SP
FACULDADE DE CIÊNCIAS HUMANAS E SOCIAIS;FUCAMP;Monte Carmelo;31;MG
FACULDADE DE TECNOLOGIA E CIÊNCIAS;FTC SALVADOR;Salvador;29;BA
INSTITUTO PARAIBANO DE ENSINO RENOVADO;INPER;João Pessoa;25;PB
FACULDADE ALFACASTELO;FCGB;Barueri;35;SP
FACULDADE DE RIBEIRÃO PRETO;AFARP;Ribeirão Preto;35;SP
FACULDADE CENECISTA DE VILA VELHA;FACEVV;Vila Velha;32;ES
FACULDADE ESAMC UBERLÂNDIA;ESAMC;Uberlândia;31;MG
FACULDADE CESUSC;;Florianópolis;42;SC
CENTRO UNIVERSITÁRIO LEONARDO DA VINCI;UNIASSELVI;Indaial;42;SC
"FACULDADE DE COMUNICAÇÃO E DESIGN ""OSWALDO CRUZ""";;São Paulo;35;SP
FACULDADE MICHELANGELO;MICHELANGELO;Brasília;53;DF
FACULDADE ANHANGUERA DE SÃO BERNARDO;FASBC;São Bernardo do Campo;35;SP
FACULDADE IBMEC;IBMEC;Belo Horizonte;31;MG
UNIVERSIDADE SALGADO DE OLIVEIRA;UNIVERSO;São Gonçalo;33;RJ
UNIVERSIDADE VILA VELHA;UVV;Vila Velha;32;ES
UNIVERSIDADE DE TAUBATÉ;UNITAU;Taubaté;35;SP
UNIVERSIDADE ESTADUAL DE FEIRA DE SANTANA;UEFS;Feira de Santana;29;BA
FACULDADES INTEGRADAS DE JACAREPAGUÁ;FIJ;Rio de Janeiro;33;RJ
CENTRO UNIVERSITÁRIO DE ENSINO SUPERIOR DO AMAZONAS;CIESA;Manaus;13;AM
UNIVERSIDADE NILTON LINS;UNINILTONLINS;Manaus;13;AM
UNIVERSIDADE SÃO FRANCISCO;USF;Bragança Paulista;35;SP
UNIVERSIDADE ANHANGUERA - UNIDERP;UNIDERP;Campo Grande;50;MS
FACULDADE DE ENGENHARIA DE SOROCABA;FACENS;Sorocaba;35;SP
CENTRO UNIVERSITÁRIO DA GRANDE DOURADOS;UNIGRAN;Dourados;50;MS
CENTRO DE ENSINO SUPERIOR DO VALE SÃO FRANCISCO;CESVASF;Belém do São Francisco;26;PE
FACULDADE DE REABILITAÇÃO DA ASCE;FRASCE;Rio de Janeiro;33;RJ
FACULDADE DO NOROESTE DE MINAS;FINOM;Paracatu;31;MG
FACULDADE DO BELO JARDIM;FBJ;Belo Jardim;26;PE
FACULDADE DE CIÊNCIAS APLICADAS DE LIMOEIRO;FACAL;Limoeiro;26;PE
UNIVERSIDADE ESTADUAL DO SUDOESTE DA BAHIA;UESB;Vitória da Conquista;29;BA
FACULDADE DE CIÊNCIAS APLICADAS E SOCIAIS DE PETROLINA;FACAPE;Petrolina;26;PE
UNIVERSIDADE FEDERAL DO ESTADO DO RIO DE JANEIRO;UNIRIO;Rio de Janeiro;33;RJ
UNIVERSIDADE FEDERAL DE MATO GROSSO DO SUL;UFMS;Campo Grande;50;MS
FUNDAÇÃO UNIVERSIDADE FEDERAL DE RONDÔNIA;UNIR;Porto Velho;11;RO
FACULDADE DE CIÊNCIAS DA ADMINISTRAÇÃO DE GARANHUNS;FAGA;Garanhuns;26;PE
FACULDADE PROFESSOR DIRSON MACIEL DE BARROS;FPDMB;Goiana;26;PE
FACULDADE DE FORMAÇÃO DE PROFESSORES DE ARARIPINA;FAFOPA;Araripina;26;PE
FACULDADE DE CIÊNCIAS AGRÁRIAS DE ARARIPINA;FACIAGRA;Araripina;26;PE
FACULDADE SÃO JOSÉ;FSJ;Rio de Janeiro;33;RJ
FACULDADE DE ARTES DULCINA DE MORAES;FADM;Brasília;53;DF
CENTRO UNIVERSITÁRIO CENTRAL PAULISTA;UNICEP;São Carlos;35;SP
FACULDADE BÉTHENCOURT DA SILVA;FABES;Rio de Janeiro;33;RJ
CENTRO UNIVERSITÁRIO HERMÍNIO DA SILVEIRA;UNI IBMR;Rio de Janeiro;33;RJ
FAE CENTRO UNIVERSITÁRIO;FAE;Curitiba;41;PR
FACULDADES INTEGRADAS DE BOTUCATU;UNIFAC;Botucatu;35;SP
FUNDAÇÃO UNIVERSIDADE FEDERAL DE CIÊNCIAS DA SAÚDE DE PORTO ALEGRE;UFCSPA;Porto Alegre;43;RS
UNIVERSIDADE POTIGUAR;UNP;Natal;24;RN
UNIVERSIDADE DO ESTADO DE MATO GROSSO;UNEMAT;Cáceres;51;MT
FACULDADE DE CIÊNCIAS HUMANAS E SOCIAIS APLICADAS DO CABO DE SANTO AGOSTINHO;FACHUCA;Cabo de Santo Agostinho;26;PE
FACULDADE DE EDUCAÇÃO DE ASSIS;FAEDA;Assis;35;SP
ESCOLA DE EDUCAÇÃO FÍSICA DE ASSIS;EEFA;Assis;35;SP
Centro Universitário FACEX;UNIFACEX;Natal;24;RN
FACULDADE DE FILOSOFIA, CIÊNCIAS E LETRAS DO ALTO SÃO FRANCISCO;FASF;Luz;31;MG
FACULDADE DE CIÊNCIAS HUMANAS DE CURVELO;FACIC;Curvelo;31;MG
UNIVERSIDADE ESTADUAL DE PONTA GROSSA;UEPG;Ponta Grossa;41;PR
FACULDADES INTEGRADAS MARIA IMACULADA;FIMI;Mogi Guaçu;35;SP
FACULDADE PITÁGORAS DE LINHARES;;Linhares;32;ES
CENTRO UNIVERSITÁRIO SÃO CAMILO;SAO CAMILO;São Paulo;35;SP
FACULDADES INTEGRADAS TERESA D´ÁVILA;FATEA;Lorena;35;SP
CENTRO UNIVERSITÁRIO SÃO CAMILO - ESPÍRITO SANTO;SÃO CAMILO-ES;Cachoeiro de Itapemirim;32;ES
FACULDADE DE EDUCAÇÃO E CIÊNCIAS HUMANAS DE ANICUNS;FECHA;Anicuns;52;GO
INSTITUTO MUNICIPAL DE ENSINO SUPERIOR DE SÃO MANUEL;IMESSM;São Manuel;35;SP
UNIVERSIDADE REGIONAL DO CARIRI;URCA;Crato;23;CE
CENTRO DE ENSINO SUPERIOR DO VALE DO PARNAÍBA;CESVALE;Teresina;22;PI
CENTRO UNIVERSITÁRIO UNIRG;UNIRG;Gurupi;17;TO
FACULDADE DE PARÁ DE MINAS;FAPAM;Pará de Minas;31;MG
FACULDADE DE CIÊNCIAS HUMANAS DO SERTÃO CENTRAL;FACHUSC;Salgueiro;26;PE
CENTRO DE ENSINO SUPERIOR DE CATALÃO;CESUC;Catalão;52;GO
CENTRO DE ENSINO SUPERIOR DE JATAÍ;CESUT;Jataí;52;GO
UNIVERSIDADE ESTADUAL DO PIAUÍ;UESPI;Teresina;22;PI
FACULDADES INTEGRADAS DO TAPAJÓS;ISES;Santarém;15;PA
FACULDADE DE CIÊNCIAS MÉDICAS E PARAMÉDICAS FLUMINENSE;SEFLU;Nilópolis;33;RJ
FACULDADE DE CIÊNCIAS HUMANAS DE PERNAMBUCO;FCHPE;Recife;26;PE
FACULDADES SPEI;FACSPEI;Curitiba;41;PR
INSTITUTO UNIFICADO DE ENSINO SUPERIOR OBJETIVO;IUESO;Goiânia;52;GO
FACULDADE PINHEIRO GUIMARÃES;FAPG;Rio de Janeiro;33;RJ
FACULDADES INTEGRADAS DE NAVIRAÍ;FINAV;Naviraí;50;MS
FACULDADE DE TECNOLOGIA DE JACAREÍ;ETEP;Jacareí;35;SP
FACULDADE DE PONTA PORÃ;FAP;Ponta Porã;50;MS
UNIVERSIDADE DE CUIABÁ;UNIC / PITÁGORAS;Cuiabá;51;MT
FACULDADE ANHANGUERA DE RONDONÓPOLIS;FAR;Rondonópolis;51;MT
FACULDADE DE EDUCAÇÃO DE TANGARÁ DA SERRA;FACEDUTS;Tangará da Serra;51;MT
FACULDADE DE RONDÔNIA;FARO;Porto Velho;11;RO
UNIVERSIDADE FEDERAL DE RORAIMA;UFRR;Boa Vista;14;RR
Faculdade Israelita de Ciências da Saúde Albert Einstein;FICSAE;São Paulo;35;SP
CENTRO UNIVERSITÁRIO DO ESTADO DO PARÁ;CESUPA;Belém;15;PA
Centro Universitário Estácio Radial de São Paulo - Estácio UNIRADIAL;ESTÁCIO UNIRADIAL;São Paulo;35;SP
CENTRO UNIVERSITÁRIO DE VÁRZEA GRANDE;UNIVAG;Várzea Grande;51;MT
FACULDADES INTEGRADAS DE DIAMANTINO;FID;Diamantino;51;MT
FACULDADE DE CIÊNCIAS SOCIAIS APLICADAS DO VALE DO SÃO LOURENÇO;EDUVALE;Jaciara;51;MT
Faculdade AVEC de Vilhena;AVEC;Vilhena;11;RO
FACULDADES INTEGRADAS DE ARACRUZ;FAACZ;Aracruz;32;ES
FACULDADE MONTENEGRO;FAM;Ibicaraí;29;BA
CENTRO UNIVERSITÁRIO CARIOCA;UNICARIOCA;Rio de Janeiro;33;RJ
FACULDADE INTERAÇÃO AMERICANA;FIA;São Bernardo do Campo;35;SP
FACULDADE DE DIREITO E CIÊNCIAS SOCIAIS DO LESTE DE MINAS - FADILESTE;FADILESTE;Reduto;31;MG
CENTRO TÉCNICO-EDUCACIONAL SUPERIOR DO OESTE PARANAENSE;CTESOP;Assis Chateaubriand;41;PR
UNIVERSIDADE DO CEUMA - UNICEUMA;UNICEUMA;São Luís;21;MA
FACULDADE DE FILOSOFIA E CIÊNCIAS HUMANAS DE GOIATUBA;FAFICH;Goiatuba;52;GO
FACULDADE PRESBITERIANA GAMMON;FAGAMMON;Lavras;31;MG
CENTRO UNIVERSITÁRIO DE DESENVOLVIMENTO DO CENTRO-OESTE;UNIDESC;Luziânia;52;GO
FACULDADE DE SÃO LOURENÇO;FASAMA;São Lourenço;31;MG
UNIVERSIDADE DO TOCANTINS;UNITINS;Palmas;17;TO
UNIVERSIDADE FEDERAL DO AMAPÁ;UNIFAP;Macapá;16;AP
FACULDADE DE CIÊNCIAS HUMANAS DO VALE DO RIO GRANDE;FCHVRG;Olímpia;35;SP
FACULDADE ARQUIDIOCESANA DE CURVELO;FAC;Curvelo;31;MG
FACULDADE DE CIÊNCIAS HUMANAS DE FORTALEZA;FCHFOR;Fortaleza;23;CE
FACULDADE DE CIÊNCIAS TECNOLÓGICAS DE FORTALEZA;FCTFOR;Fortaleza;23;CE
FACULDADE VITORIANA DE CIÊNCIAS CONTÁBEIS;FAVI;Vitória;32;ES
FACULDADE VITORIANA DE TECNOLOGIA;FAVI;Vitória;32;ES
FACULDADE DE CIÊNCIAS E TECNOLOGIA DE BIRIGUI;FATEB;Birigui;35;SP
FACULDADE DA FUNDAÇÃO EDUCACIONAL ARAÇATUBA;FAC-FEA;Araçatuba;35;SP
FACULDADE DE ADMINISTRAÇÃO DE TERESINA;FAT;Teresina;22;PI
FACULDADE PIAUIENSE DE PROCESSAMENTO DE DADOS;FPPD;Teresina;22;PI
FACULDADE PARAIBANA DE PROCESSAMENTO DE DADOS;FPPD;João Pessoa;25;PB
FACULDADE JESUÍTA DE FILOSOFIA E TEOLOGIA;FAJE;Belo Horizonte;31;MG
FACULDADE DE INFORMÁTICA E ADMINISTRAÇÃO PAULISTA;FIAP;São Paulo;35;SP
CENTRO DE ENSINO SUPERIOR DO AMAPÁ;CEAP;Macapá;16;AP
FACULDADE ESTÁCIO DE SÁ DE CAMPO GRANDE;FESCG;Campo Grande;50;MS
FACULDADES UNIFICADAS DE FOZ DO IGUAÇU;UNIFOZ;Foz do Iguaçu;41;PR
FACULDADE DE ESTUDOS SOCIAIS APLICADOS DE VIANA;FESAV;Viana;32;ES
FACULDADE DE ECONOMIA E PROCESSAMENTO DE DADOS DE FOZ DO IGUAÇU;FEPI;Foz do Iguaçu;41;PR
CENTRO UNIVERSITÁRIO DO LESTE DE MINAS GERAIS;UNILESTEMG;Coronel Fabriciano;31;MG
INSTITUTO MUNICIPAL DE ENSINO SUPERIOR DE ASSIS;IMESA;Assis;35;SP
INSTITUTO MUNICIPAL DE ENSINO SUPERIOR DE BEBEDOURO VICTÓRIO CARDASSI;IMESB;Bebedouro;35;SP
FACULDADE DE HORTOLÂNDIA;FACH;Hortolândia;35;SP
ESCOLA DE GOVERNO PROFESSOR PAULO NEVES DE CARVALHO;EG;Belo Horizonte;31;MG
FACULDADE  PITÁGORAS;;Belo Horizonte;31;MG
FACULDADE DE CIÊNCIAS ECONÔMICAS E ADMINISTRATIVAS SANTA RITA DE CÁSSIA;FACEAS;São Paulo;35;SP
FACULDADE DE CIÊNCIAS ADMINISTRATIVAS E DE TECNOLOGIA;FATEC;Porto Velho;11;RO
FACULDADE ESCOLA PAULISTA DE DIREITO;FACEPD;São Paulo;35;SP
FACULDADE DE EDUCAÇÃO E CIÊNCIAS GERENCIAIS DE SUMARÉ;FECGS;Sumaré;35;SP
FACULDADE ALAGOANA DE ADMINISTRAÇÃO;FAA;Maceió;27;AL
FACULDADE DE BELFORD ROXO;FABEL;Belford Roxo;33;RJ
FACULDADE SANTA LÚCIA;FCACSL;Moji Mirim;35;SP
FACULDADES INTEGRADAS DE PARANAÍBA - FIPAR;FIPAR;Paranaíba;50;MS
FACULDADE DE ADMINISTRAÇÃO DE FÁTIMA DO SUL;FAFS;Fátima do Sul;50;MS
FACULDADE DE CIÊNCIAS, SAÚDE, EXATAS E JURÍDICAS DE TERESINA;FACULDADE CEUT;Teresina;22;PI
FACULDADE DE CIÊNCIAS CONTÁBEIS DE NAVIRAI;FACINAV;Naviraí;50;MS
FACULDADE DE CIÊNCIAS SOCIAIS APLICADAS DE CASCAVEL;FCSAC;Cascavel;41;PR
FACULDADE REGES DE DRACENA;FCGD;Dracena;35;SP
FACULDADE DE ADMINISTRAÇÃO E CIÊNCIAS CONTÁBEIS DE SÃO ROQUE;FACCSR;São Roque;35;SP
CENTRO UNIVERSITÁRIO ANHANGUERA DE CAMPO GRANDE;;Campo Grande;50;MS
FACULDADE CATÓLICA DE ANÁPOLIS;CATÓLICA DE ANÁPOLIS;Anápolis;52;GO
Faculdades Magsul;FAMAG;Ponta Porã;50;MS
ESCOLA SUPERIOR DE PROPAGANDA E MARKETING DO RIO DE JANEIRO;ESPM;Rio de Janeiro;33;RJ
INSTITUTO DE CIÊNCIAS SOCIAIS E HUMANAS;INCISOH;Januária;31;MG
UNIVERSIDADE SANTA CECÍLIA;UNISANTA;Santos;35;SP
UNIVERSIDADE METROPOLITANA DE SANTOS;UNIMES;Santos;35;SP
FACULDADE DE TECNOLOGIA DE TAQUARITINGA;FATEC/TQ;Taquaritinga;35;SP
FACULDADE DE LUCÉLIA;;Lucélia;35;SP
FACULDADES INTEGRADAS DE PONTA PORÃ;FIP;Ponta Porã;50;MS
FACULDADE PRUDENTE DE MORAES;FPM;Itu;35;SP
FACULDADE DE CIÊNCIAS E EDUCAÇÃO DE RUBIATABA;FACER;Rubiataba;52;GO
ESCOLA SUPERIOR EM MEIO AMBIENTE;ESMA;Iguatama;31;MG
FACULDADE SENAI-CETIQT;SENAI-CETIQT;Rio de Janeiro;33;RJ
Faculdade de Duque de Caxias;FDC;Duque de Caxias;33;RJ
Centro Universitário de Bauru;;Bauru;35;SP
FACULDADE DE FORMAÇÃO DE PROFESSORES DE AFOGADOS DA INGAZEIRA;FAFOPAI;Afogados da Ingazeira;26;PE
FACULDADE SUDOESTE PAULISTANO;FASUP;São Paulo;35;SP
INSTITUTO SUPERIOR E CENTRO EDUCACIONAL LUTERANO - BOM JESUS - IELUSC;BOM JESUS/IELUSC;Joinville;42;SC
FACULDADE DE CIÊNCIAS E TECNOLOGIA DE UNAÍ - FACTU;FACTU;Unaí;31;MG
FACULDADE DE CIÊNCIAS DE TIMBAÚBA;FACET;Timbaúba;26;PE
UNIVERSIDADE ESTADUAL DO NORTE FLUMINENSE DARCY RIBEIRO;UENF;Campos dos Goytacazes;33;RJ
UNIVERSIDADE ESTADUAL DE MATO GROSSO DO SUL;UEMS;Dourados;50;MS
FACULDADE DE ECONOMIA E FINANÇAS IBMEC;FACULDADES IBMEC;Rio de Janeiro;33;RJ
CENTRO UNIVERSITÁRIO SALESIANO DE SÃO PAULO;UNISAL;Americana;35;SP
UNIÃO DE ESCOLAS SUPERIORES DA FUNESO;UNESF;Olinda;26;PE
UNIVERSIDADE DO ESTADO DE MINAS GERAIS;UEMG;Belo Horizonte;31;MG
FACULDADES INTEGRADAS DE TRÊS LAGOAS;AEMS;Três Lagoas;50;MS
CENTRO UNIVERSITÁRIO UNIVATES;UNIVATES;Lajeado;43;RS
UNIVERSIDADE POSITIVO;UP;Curitiba;41;PR
CENTRO UNIVERSITÁRIO HERMINIO OMETTO;UNIARARAS;Araras;35;SP
CENTRO UNIVERSITÁRIO ANHANGÜERA;UNIFIAN;Leme;35;SP
UNIÃO DAS FACULDADES DOS GRANDES LAGOS;UNILAGO;São José do Rio Preto;35;SP
FACULDADE CAMPOS ELÍSEOS;FCE;São Paulo;35;SP
INSTITUTO DE ENSINO SUPERIOR FUCAPI;CESF;Manaus;13;AM
FACULDADE DA SEUNE;SEUNE;Maceió;27;AL
FACULDADE DE TECNOLOGIA E CIÊNCIAS DE FEIRA DE SANTANA;FTC;Feira de Santana;29;BA
FACULDADE MAURÍCIO DE NASSAU DE SALVADOR;FMN SALVADOR;Salvador;29;BA
Estácio FIB - Centro Universitário Estácio da Bahia;Estácio FIB;Salvador;29;BA
FACULDADE LOURENÇO FILHO;FLF;Fortaleza;23;CE
CENTRO UNIVERSITÁRIO DO INSTITUTO DE EDUCAÇÃO SUPERIOR DE BRASÍLIA - IESB;IESB;Brasília;53;DF
Faculdade Doctum de Vila Velha;DOCTUM;Vila Velha;32;ES
Faculdade Doctum de Vitória;DOCTUM;Vitória;32;ES
INSTITUTO DE ENSINO E PESQUISA OBJETIVO;IEPO;Palmas;17;TO
FACULDADE DE JUSSARA;FAJ;Jussara;52;GO
FACULDADE ALDETE MARIA ALVES;FAMA;Iturama;31;MG
FACULDADE CNEC UNAÍ;;Unaí;31;MG
INSTITUTO DE ENSINO SUPERIOR DA FUNLEC;IESF;Campo Grande;50;MS
FACULDADE AFIRMATIVO;FAFI;Cuiabá;51;MT
INSTITUTO DE EDUCAÇÃO SUPERIOR DA PARAÍBA;IESP;João Pessoa;25;PB
FACULDADE DE FILOSOFIA, CIÊNCIAS E LETRAS DE CAJAZEIRAS;FAFIC;Cajazeiras;25;PB
Faculdade Estácio do Recife - Estácio FIR;Estácio FIR;Recife;26;PE
FACULDADE INTEGRADO DE CAMPO MOURÃO;CEI;Campo Mourão;41;PR
FACULDADE MARINGÁ;CESPAR;Maringá;41;PR
FACULDADE ARTHUR SÁ EARP NETO;FASE;Petrópolis;33;RJ
FACULDADE DE ENGENHARIA DE RESENDE;FER;Resende;33;RJ
INSTITUTO FEDERAL DE EDUCAÇÃO, CIÊNCIA E TECNOLOGIA DO RIO GRANDE DO NORTE;IFRN;Natal;24;RN
FACULDADE CENECISTA DE BENTO GONÇALVES;FACEBG;Bento Gonçalves;43;RS
FACULDADE METODISTA DE SANTA MARIA;FAMES;Santa Maria;43;RS
FACULDADE DE EDUCAÇÃO DE COLORADO DO OESTE;FAEC;Colorado do Oeste;11;RO
FACULDADES INTEGRADAS APARÍCIO CARVALHO;FIMCA;Porto Velho;11;RO
FACULDADE SÃO LUÍS DE FRANÇA;FSLF;Aracaju;28;SE
FACULDADES INTEGRADAS DE BAURU;FIB;Bauru;35;SP
FACULDADE DE PRESIDENTE EPITÁCIO - FAPE;FAPE;Presidente Epitácio;35;SP
FACULDADES INTEGRADAS DE SÃO PAULO;FISP;São Paulo;35;SP
FACULDADE DE EDUCAÇÃO E CIÊNCIAS GERENCIAIS DE SÃO PAULO;FECG-SP;São Paulo;35;SP
FACULDADE CARLOS DRUMMOND DE ANDRADE;FCDA;São Paulo;35;SP
Centro Universitário Estácio do Ceará;Estácio FIC;Fortaleza;23;CE
CENTRO UNIVERSITÁRIO EURO-AMERICANO;UNIEURO;Brasília;53;DF
FACULDADE SANTA TEREZINHA;CEST;São Luís;21;MA
UNIÃO DAS ESCOLAS DO GRUPO FAIMI DE EDUCAÇÃO;FAIMI;Mirassol;35;SP
INSTITUTO FEDERAL DE EDUCAÇÃO, CIÊNCIA E TECNOLOGIA FLUMINENSE;IF Fluminense;Campos dos Goytacazes;33;RJ
FACULDADE REGES DE OSVALDO CRUZ;;Osvaldo Cruz;35;SP
INSTITUTO DE EDUCAÇÃO SUPERIOR UNYAHNA DE SALVADOR;IESUS;Salvador;29;BA
INSTITUTO DE EDUCAÇÃO SUPERIOR UNYAHNA DE BARREIRAS;IESUB;Barreiras;29;BA
FACULDADES INTEGRADAS ESPÍRITA;FIES;Curitiba;41;PR
UNIVERSIDADE ESTADUAL DO CENTRO OESTE;UNICENTRO;Guarapuava;41;PR
UNIVERSIDADE DE ITAÚNA;UI;Itaúna;31;MG
CENTRO UNIVERSITÁRIO DO NORTE PAULISTA;UNORP;São José do Rio Preto;35;SP
FACULDADE METODISTA DE CIÊNCIAS HUMANAS E EXATAS;METODISTA;Birigui;35;SP
FACULDADE SANTO AGOSTINHO;FSA;Teresina;22;PI
FACULDADE DE CIÊNCIAS HUMANAS E SOCIAIS DE IGARASSU;FACIG;Igarassu;26;PE
FACULDADE DE ESTUDOS ADMINISTRATIVOS DE MINAS GERAIS - FEAD-MG;FEAD - MG;Belo Horizonte;31;MG
FACULDADE GAMA E SOUZA;FGS;Rio de Janeiro;33;RJ
FACULDADES INTEGRADAS DE VITÓRIA;FDV;Vitória;32;ES
FACULDADE DE CIÊNCIAS HUMANAS;IMENSU;Mairiporã;35;SP
CENTRO UNIVERSITÁRIO NOSSA SENHORA DO PATROCÍNIO;CEUNSP;Salto;35;SP
FACULDADE SENAI DE TECNOLOGIA GRÁFICA;SP SENAI;São Paulo;35;SP
FACULDADE DE ADMINISTRAÇÃO E NEGÓCIOS DE SERGIPE;FANESE;Aracaju;28;SE
UNIVERSIDADE CÂNDIDO MENDES;UCAM;Rio de Janeiro;33;RJ
FACULDADE SALESIANA DE SANTA TERESA;FSST;Corumbá;50;MS
FACULDADE CENECISTA DE ITABORAÍ;FACNEC;Itaboraí;33;RJ
ESCOLA SUPERIOR SÃO FRANCISCO DE ASSIS;ESFA;Santa Teresa;32;ES
CENTRO DE ENSINO SUPERIOR DE VITÓRIA;CESV;Vitória;32;ES
FACULDADE CAMBURY;CAMBURY;Goiânia;52;GO
INSPER INSTITUTO DE ENSINO E PESQUISA;INSPER;São Paulo;35;SP
FACULDADE DE ALTA FLORESTA;FAF;Alta Floresta;51;MT
INSTITUTO FEDERAL DE EDUCAÇÃO, CIÊNCIA E TECNOLOGIA  DA PARAÍBA;IFPB;João Pessoa;25;PB
FACULDADE METROPOLITANA DE CAMAÇARI;FAMEC;Camaçari;29;BA
FACULDADE ANHANGUERA DE BRASÍLIA;FAB;Brasília;53;DF
FACULDADE DE SABARÁ;SOECS;Sabará;31;MG
FACULDADE ESTÁCIO DO RIO GRANDE DO SUL - ESTÁCIO FARGS;ESTÁCIO FARGS;Porto Alegre;43;RS
INSTITUTO DE ENSINO SUPERIOR DE AMERICANA;IESA;Americana;35;SP
CENTRO UNIVERSITÁRIO JORGE AMADO;UNIJORGE;Salvador;29;BA
CENTRO UNIVERSITÁRIO MÓDULO;MÓDULO;Caraguatatuba;35;SP
UNIVERSIDADE DO PLANALTO CATARINENSE;UNIPLAC;Lages;42;SC
FACULDADE INTEGRAL CANTAREIRA;F.I.C.;São Paulo;35;SP
INSTITUTO DE ENSINO SUPERIOR DE FORTALEZA;IESF;Fortaleza;23;CE
FACULDADE DE CIÊNCIAS DA SAÚDE DE SÃO PAULO;FACIS;São Paulo;35;SP
FACULDADE SENAI DE TECNOLOGIA MECATRÔNICA;SENAI;São Caetano do Sul;35;SP
CENTRO UNIVERSITÁRIO DE MARINGÁ - UNICESUMAR;UNICESUMAR;Maringá;41;PR
FACULDADE DE CIÊNCIAS SOCIAIS E APLICADAS DO PARANÁ;FACET;Curitiba;41;PR
FACULDADE DE ADMINISTRAÇÃO MILTON CAMPOS;FAMC;Nova Lima;31;MG
FACULDADE SANTA RITA;FASAR;Conselheiro Lafaiete;31;MG
FACULDADE DE AMAMBAI;FIAMA;Amambai;50;MS
FACULDADE EDUCACIONAL DA LAPA;FAEL;Lapa;41;PR
FAL ESTÁCIO - FACULDADE ESTÁCIO DE NATAL;;Natal;24;RN
FACULDADE INTEGRADA DE ENSINO SUPERIOR DE COLINAS;FIESC;Colinas do Tocantins;17;TO
CENTRO UNIVERSITÁRIO FUNDAÇÃO DE ENSINO OCTÁVIO BASTOS - FEOB;UNIFEOB;São João da Boa Vista;35;SP
Escola de Estudos Superiores de Viçosa;ESUV;Viçosa;31;MG
FACULDADES INTEGRADAS RIO BRANCO;FRB;São Paulo;35;SP
FACULDADES INTEGRADAS DE VÁRZEA GRANDE;FIAVEC;Várzea Grande;51;MT
FACULDADE CASTELO BRANCO;FCB;Colatina;32;ES
CENTRO UNIVERSITÁRIO ANTÔNIO EUFRÁSIO DE TOLEDO DE PRESIDENTE PRUDENTE - TOLEDO PRUDENTE;TOLEDO PRUDENTE;Presidente Prudente;35;SP
FACULDADES INTEGRADAS MACHADO DE ASSIS;FEMA;Santa Rosa;43;RS
FACULDADE DE ADMINISTRAÇÃO DE CAMPO BELO;FACAMP;Campo Belo;31;MG
FACULDADES INTEGRADAS STELLA MARIS DE ANDRADINA;FISMA;Andradina;35;SP
FEFISA - FACULDADES INTEGRADAS DE SANTO ANDRÉ;FEFISA;Santo André;35;SP
CENTRO UNIVERSITÁRIO DE LINS;UNILINS;Lins;35;SP
FACULDADE PITÁGORAS DE IMPERATRIZ;;Imperatriz;21;MA
FACULDADE ALVORADA DE TECNOLOGIA E EDUCAÇÃO DE MARINGÁ;FACULDADE ALVORADA;Maringá;41;PR
ESCOLA BRASILEIRA DE ADMINISTRAÇÃO PÚBLICA E DE EMPRESAS;EBAPE;Rio de Janeiro;33;RJ
FACULDADE SABERES;SABERES;Vitória;32;ES
FACULDADE DE TECNOLOGIA IBTA;IBTA;São Paulo;35;SP
CLARETIANO - FACULDADE - CLARETIANORC;CLARETIANORC;Rio Claro;35;SP
FACULDADE DO NORTE NOVO DE APUCARANA;FACNOPAR;Apucarana;41;PR
FACULDADE DEHONIANA;DEHONIANA;Taubaté;35;SP
FACULDADE INTEGRADA EUCLIDES FERNANDES;FAJ;Jequié;29;BA
FACULDADE DE CIÊNCIAS GERENCIAIS PADRE ARNALDO JANSSEN;FAJANSSEN;Belo Horizonte;31;MG
FACULDADE DA REGIÃO SERRANA;FARESE;Santa Maria de Jetibá;32;ES
FACULDADE MANTENENSE DOS VALES GERAIS (INTERVALE);INTERVALE;Mantena;31;MG
FACULDADE DE ADMINISTRAÇÃO DA ASSOCIAÇÃO BRASILIENSE DE EDUCAÇÃO;FABE;Marau;43;RS
INSTITUTO SUPERIOR DE EDUCAÇÃO ALVORADA PLUS;ISEAP;São Paulo;35;SP
FACULDADE DE CIÊNCIAS EMPRESARIAIS E ESTUDOS COSTEIROS DE NATAL;FACEN;Natal;24;RN
FACULDADE DE CIÊNCIAS GERENCIAIS DE SANTOS DUMONT;FACIG;Santos Dumont;31;MG
INSTITUTO SUPERIOR DE EDUCAÇÃO DE SANTOS DUMONT;ISESD;Santos Dumont;31;MG
CENTRO UNIVERSITÁRIO DE ITAJUBÁ;FEPI;Itajubá;31;MG
FACULDADES INTEGRADAS REGIONAIS DE AVARÉ;FIRA;Avaré;35;SP
FACULDADES INTEGRADAS SANTA CRUZ DE CURITIBA;FARESC;Curitiba;41;PR
FACULDADE MERCÚRIO;FAMERC;Rio de Janeiro;33;RJ
FACULDADE DE TECNOLOGIA DE OURINHOS;FATEC;Ourinhos;35;SP
FACULDADE DE FILOSOFIA, CIÊNCIAS E LETRAS DE IBITINGA;FAIBI;Ibitinga;35;SP
FACULDADE MUNICIPAL PROFESSOR FRANCO MONTORO DE MOGI GUAÇU;FMPFM;Mogi Guaçu;35;SP
FACULDADE ATUAL;FAAT;Macapá;16;AP
CENTRO UNIVERSITÁRIO DA FUNDAÇÃO EDUCACIONAL INACIANA PE SABÓIA DE MEDEIROS;FEI;São Bernardo do Campo;35;SP
FACULDADE EDUCACIONAL DE ARAUCÁRIA;FACEAR;Araucária;41;PR
FACULDADE CASA DO ESTUDANTE;FACE;Aracruz;32;ES
FACULDADE DA ESCADA;FAESC;Escada;26;PE
FACULDADE DE CIÊNCIAS AGRÁRIAS E DA SAÚDE;FAS;Lauro de Freitas;29;BA
FACULDADE RANCHARIENSE;FRAN;Rancharia;35;SP
