nome;sigla;municipio;id_uf;uf
FACULDADE DE TECNOLOGIA EVOLUÇÃO;FECET;Fortaleza;23;CE
FACULDADE ANHANGÜERA DE CAMPINAS;;Campinas;35;SP
ESCOLA SUPERIOR DE ARTES CÉLIA HELENA;;São Paulo;35;SP
FACULDADE DE EDUCAÇÃO  ACRIANA EUCLIDES DA CUNHA;INEC;Rio Branco;12;AC
FACULDADE VÉRTICE;VÉRTICE;Matipó;31;MG
FACULDADE DIOCESANA DE MOSSORÓ;;Mossoró;24;RN
FACULDADE DE CIÊNCIAS HUMANAS, ECONÔMICAS E DA SAÚDE DE ARAGUAÍNA;FAHESA / ITPAC;Araguaína;17;TO
ESCOLA SUPERIOR DE SAÚDE DE ARCOVERDE;ESSA;Arcoverde;26;PE
FACULDADE PITÁGORAS DE POÇOS DE CALDAS;;Poços de Caldas;31;MG
FACULDADE PITÁGORAS DE SÃO LUIZ;;São Luís;21;MA
FACULDADE PITÁGORAS DE GUARAPARI;;Guarapari;32;ES
FACULDADE DE TECNOLOGIA DE TAUBATÉ;ETEP;Taubaté;35;SP
FACULDADE ANHANGUERA DE ITAPECERICA DA SERRA;;Itapecerica da Serra;35;SP
FACULDADE DE CONCHAS;;Conchas;35;SP
FACULDADE DE CIÊNCIAS MÉDICAS DA BAHIA;CIENCIAS MEDICAS;Santa Cruz Cabrália;29;BA
FACULDADE FASIPE;FASIPE;Sinop;51;MT
FACULDADE BATISTA PIONEIRA;;Ijuí;43;RS
FACULDADE DO TRABALHO;FATRA;Uberlândia;31;MG
FACULDADE DE CASTANHAL;FCAT;Castanhal;15;PA
FACULDADE ANGLO;;Piracicaba;35;SP
FACULDADE INTEGRADA DAS CATARATAS;;Foz do Iguaçu;41;PR
FUNDAÇÃO UNIVERSIDADE FEDERAL DO ABC;UFABC;Santo André;35;SP
FACULDADE DE TECNOLOGIA DE PRAIA GRANDE;FATECPG;Praia Grande;35;SP
FACULDADE CLARETIANA DE TEOLOGIA;;Curitiba;41;PR
ESCOLA SUPERIOR DE ADMINISTRAÇÃO E GESTÃO STRONG DA BAIXADA SANTISTA;;Santos;35;SP
FACULDADE INTERNACIONAL DO DELTA;INTA;Parnaíba;22;PI
FACULDADE AUM;;Cuiabá;51;MT
FACULDADE PITÁGORAS DE FEIRA DE SANTANA;;Feira de Santana;29;BA
CENTRO UNIVERSITÁRIO DE SETE LAGOAS;UNIFEMM;Sete Lagoas;31;MG
FACULDADE DE CIÊNCIAS E TECNOLOGIA DO MARANHÃO;FACEMA;Caxias;21;MA
FACULDADE ITOP;ITOP;Palmas;17;TO
FACULDADE METROPOLITANA DO PLANALTO NORTE;FAMEPLAN;Canoinhas;42;SC
FACULDADE DE SÃO JOSÉ DOS CAMPOS;BILAC;São José dos Campos;35;SP
FACULDADE DE TECNOLOGIA CENTEC - SERTÃO CENTRAL;FTC SERTÃO CENTRAL;Quixeramobim;23;CE
FACULDADE CRUZ AZUL;FACRAZ;São Paulo;35;SP
FACULDADE ESTAÇÃO;FAEST;Curitiba;41;PR
CENTRO UNIVERSITÁRIO ESTADUAL DA ZONA OESTE;UEZO;Rio de Janeiro;33;RJ
FACULDADE DE EDUCAÇÃO TECNOLÓGICA DO ESTADO DO RIO DE JANEIRO - FAETERJ;FAETERJ R DE JANEIRO;Rio de Janeiro;33;RJ
FACULDADE DE EDUCAÇÃO TECNOLÓGICA DO ESTADO DO RIO DE JANEIRO - FAETERJ;FAETERJ PETRÓPOLIS;Petrópolis;33;RJ
INSTITUTO SUPERIOR DE EDUCAÇÃO PROFESSOR ALDO MUYLAERT;ISEPAM;Campos dos Goytacazes;33;RJ
FACULDADE DE EDUCAÇÃO TECNOLÓGICA DO ESTADO DO RIO DE JANEIRO - FAETERJ;FAETERJ S ANT. PÁDUA;Santo Antônio de Pádua;33;RJ
FACULDADE DE EDUCAÇÃO TECNOLÓGICA DO ESTADO DO RIO DE JANEIRO - FAETERJ;FAETERJ ITAPERUNA;Itaperuna;33;RJ
FACULDADE SANTO AUGUSTO;FAISA;Santo Augusto;43;RS
Faculdade São Braz;FSB;Curitiba;41;PR
INSTITUTO FEDERAL DE EDUCAÇÃO, CIÊNCIA E TECNOLOGIA CATARINENSE;IF Catarinense;Blumenau;42;SC
FACULDADE DE CIÊNCIAS SOCIAIS APLICADAS DE MARABÁ;FACIMAB;Marabá;15;PA
FACULDADE DE DIREITO DE GARANHUNS;FDG;Garanhuns;26;PE
FACULDADE DE TECNOLOGIA PAULISTA;;Lupércio;35;SP
FACULDADE POLIS DAS ARTES;;Embu das Artes;35;SP
FACULDADE DE TEOLOGIA DE SÃO PAULO DA IGREJA PRESBITERIANA INDEPENDENTE DO BRASIL;;São Paulo;35;SP
FACULDADE DE EDUCAÇÃO TECNOLÓGICA DO ESTADO DO RIO DE JANEIRO - FAETERJ;FAETERJ BJ ITABAPOAN;Bom Jesus do Itabapoana;33;RJ
FACULDADE DE EDUCAÇÃO TECNOLÓGICA DO ESTADO DO RIO DE JANEIRO - FAETERJ;FAETERJ TRÊS RIOS;Três Rios;33;RJ
FACULDADE DE EDUCAÇÃO TECNOLÓGICA DO ESTADO DO RIO DE JANEIRO;FAETERJ PARACAMBI;Paracambi;33;RJ
FACULDADE PITÁGORAS DE TECNOLOGIA DE CONTAGEM;;Contagem;31;MG
UNIVERSIDADE ESTADUAL DE RORAIMA;UERR;Boa Vista;14;RR
FACULDADE EDUCACIONAL DE MATELÂNDIA;FAMA;Matelândia;41;PR
FACULDADE DE TECNOLOGIA DE SÃO BERNARDO DO CAMPO;FATEC-SB;São Bernardo do Campo;35;SP
FACULDADE INTERNACIONAL SIGNORELLI;;Rio de Janeiro;33;RJ
FACULDADE SOGIPA DE EDUCAÇÃO FÍSICA;;Porto Alegre;43;RS
FACULDADE FACMIL;;São José do Rio Preto;35;SP
FACULDADE DE TECNOLOGIA SENAC CAÇADOR;SENAC;Caçador;42;SC
FACULDADE DE TECNOLOGIA SENAC SÃO MIGUEL DO OESTE;5133;São Miguel do Oeste;42;SC
INSTITUTO ASSIS GURGACZ;;Cascavel;41;PR
FACULDADES INTEGRADAS PADRE ALBINO;FIPA;Catanduva;35;SP
FACULDADE ANHANGUERA DE EDUCAÇÃO, CIÊNCIAS E TECNOLOGIA DE SOROCABA;FAECTS;Sorocaba;35;SP
FACULDADES INTEGRADAS PAULISTA;FIP;São Paulo;35;SP
FACULDADE RAIMUNDO MARINHO;FRM;Maceió;27;AL
UNIVERSIDADE ESTADUAL DE ALAGOAS - UNEAL;UNEAL;Arapiraca;27;AL
FACULDADE DE CIÊNCIAS JURÍDICAS DE SANTOS DUMONT;FCJSD;Santos Dumont;31;MG
Faculdade Doctum de Carangola;DOCTUM;Carangola;31;MG
FACULDADE FORTIUM;;Brasília;53;DF
FACULDADES INTEGRADAS DE TAQUARA;FACCAT;Taquara;43;RS
FACULDADE ANHANGÜERA DE RIBEIRÃO PRETO;;Ribeirão Preto;35;SP
FACULDADE ANHANGUERA DE CIÊNCIAS E TECNOLOGIA DE BRASÍLIA;;Brasília;53;DF
FACULDADE ANHANGÜERA DE DOURADOS;FAD;Dourados;50;MS
FACULDADE DE CIÊNCIAS SOCIAIS APLICADAS E HUMANAS DE GARANHUNS;FAHUG;Garanhuns;26;PE
FACULDADES ATIBAIA;FAAT;Atibaia;35;SP
Faculdades Unificadas de Cataguases;FUC;Cataguases;31;MG
Faculdades Unificadas de Guarapari;FUG;Guarapari;32;ES
Faculdades Unificadas de Iúna;FUI;Iúna;32;ES
Faculdades Unificadas de Leopoldina;FUL;Leopoldina;31;MG
FACULDADE PORTO-ALEGRENSE;FAPA;Porto Alegre;43;RS
FACULDADE GUILHERME GUIMBALA;FGG;Joinville;42;SC
FUNDAÇÃO UNIVERSIDADE FEDERAL DO PAMPA - UNIPAMPA;UNIPAMPA;Bagé;43;RS
FACULDADE SERIGY;FASERGY;Aracaju;28;SE
FACULDADES INTEGRADAS ASMEC;ASMEC;Ouro Fino;31;MG
Faculdades Unificadas de Teófilo Otoni;FUTO;Teófilo Otoni;31;MG
FACULDADE IMPACTA DE TECNOLOGIA;FIT;São Paulo;35;SP
INSTITUTO DE ENSINO SUPERIOR INTEGRADO-IESI;FENORD;Teófilo Otoni;31;MG
FACULDADES OPET;;Curitiba;41;PR
FACULDADES INTEGRADAS DA UNIÃO EDUCACIONAL DO PLANALTO CENTRAL - FACIPLAC;FACIPLAC;Brasília;53;DF
FACULDADE ANHANGÜERA DE BAURU;;Bauru;35;SP
FACULDADE DE CIÊNCIA, TECNOLOGIA E EDUCAÇÃO;FACITE;Santa Maria da Vitória;29;BA
FACULDADE CAMPO REAL;CAMPO REAL;Guarapuava;41;PR
FACULDADE GUARAPUAVA;FG;Guarapuava;41;PR
FACULDADE CATHEDRAL;FACES;Boa Vista;14;RR
FACULDADE PRESIDENTE ANTÔNIO CARLOS;FAPAC;Porto Nacional;17;TO
FACULDADE ANHANGUERA DE ANÁPOLIS;FAAA;Anápolis;52;GO
FACULDADE ANHANGUERA DE JACAREÍ;;Jacareí;35;SP
FACULDADES INTEGRADAS CAMÕES;FICA;Curitiba;41;PR
FACULDADES INTEGRADAS DO NORTE DE MINAS - FUNORTE;FUNORTE;Montes Claros;31;MG
FACULDADE ADVENTISTA DE HORTOLÂNDIA;FAH;Hortolândia;35;SP
LIBERTAS - FACULDADES INTEGRADAS;LIBERTAS;São Sebastião do Paraíso;31;MG
FACULDADES INTEGRADAS SÃO JUDAS TADEU;SJT;Porto Alegre;43;RS
FACULDADE DE TECNOLOGIA DE PRESIDENTE PRUDENTE;FATEC;Presidente Prudente;35;SP
FACULDADE DE TECNOLOGIA DE BRAGANÇA PAULISTA;;Bragança Paulista;35;SP
FACULDADE DE VARGEM GRANDE PAULISTA;;Vargem Grande Paulista;35;SP
FACULDADE DE CIÊNCIAS HUMANAS E SOCIAIS DE ARARIPINA - FACISA;FACISA;Araripina;26;PE
FACULDADE ANHANGUERA DE JOINVILLE;;Joinville;42;SC
FACULDADE DE TECNOLOGIA DE SÃO JOSÉ DOS CAMPOS;ETEP;São José dos Campos;35;SP
FACULDADES UNIDAS DO VALE DO ARAGUAIA;UNIVAR;Barra do Garças;51;MT
CENTRO UNIVERSITÁRIO SÃO JOSÉ DE ITAPERUNA;;Itaperuna;33;RJ
UNIVERSIDADE DO ESTADO DO AMAPÁ;UEAP;Macapá;16;AP
FACULDADE MUNICIPAL DE PALHOÇA;FMP;Palhoça;42;SC
FACULDADE OBOÉ - FACO;FACO;Fortaleza;23;CE
FACULDADE DE TECNOLOGIA DE VALENÇA;FACTIVA;Valença;29;BA
FACULDADE DE TEOLOGIA E CIÊNCIAS HUMANAS;ITEPAFACULDADES;Passo Fundo;43;RS
FACULDADE DE TECNOLOGIA SENAI MATO GROSSO (FATEC SENAI MT);FATEC SENAI MT;Cuiabá;51;MT
FACULDADE DE TECNOLOGIA BANDEIRANTES;BANDTEC;São Paulo;35;SP
FACULDADE DE TECNOLOGIA IPPEO;IPPEO;Curitiba;41;PR
INSTITUTO SÃO PAULO DE ESTUDOS SUPERIORES;ITESP;São Paulo;35;SP
FACULDADE HSM;;Santa Rita do Passa Quatro;35;SP
FACULDADE JOAQUIM NABUCO DE SÃO LOURENÇO DA MATA;;São Lourenço da Mata;26;PE
FACULDADE DE SAÚDE DE PAULISTA;FASUP;Paulista;26;PE
FACULDADE NORTE CAPIXABA DE SAO MATEUS;MULTIVIX SÃO MATEUS;São Mateus;32;ES
FACULDADE UNIÃO ARARUAMA DE ENSINO S/S Ltda.;FAC-UNILAGOS;Araruama;33;RJ
FACULDADE CENTRO OESTE;FACEOPAR;Laranjeiras do Sul;41;PR
ESCOLA SUPERIOR NACIONAL DE SEGUROS DE SÃO PAULO;ESNS-SP;São Paulo;35;SP
FACULDADE ANHANGUERA DE SUMARÉ;FACSUMARÉ;Sumaré;35;SP
FACULDADE VILLA-LOBOS DO CONE-LESTE PAULISTA;FAV-COLESP;São José dos Campos;35;SP
FACULDADE DE TECNOLOGIA ALTO MÉDIO SÃO FRANCISCO;FAC FUNAM;Pirapora;31;MG
FACULDADE ESPECIALIZADA NA ÁREA DE SAÚDE DO RIO GRANDE DO SUL;FASURGS;Passo Fundo;43;RS
FACULDADE METROPOLITANA DE ANÁPOLIS;FAMA;Anápolis;52;GO
FACULDADE DE TECNOLOGIA DA SERRA GAÚCHA - CAXIAS DO SUL;FTSG;Caxias do Sul;43;RS
FACULDADE CAL DE ARTES CÊNICAS;Faculdade Cal;Rio de Janeiro;33;RJ
FACULDADE DAMAS DA INSTRUÇÃO CRISTÃ;FADIC;Recife;26;PE
CENTRO UNIVERSITÁRIO DA FUNDAÇÃO EDUCACIONAL DE BARRETOS;UNIFEB;Barretos;35;SP
Faculdades Integradas do Rio Grande do Norte - FANORTES;;Natal;24;RN
FACULDADE CATÓLICA SANTA TERESINHA;FCST;Caicó;24;RN
FACULDADE ANHANGUERA DE CUIABÁ;FAC;Cuiabá;51;MT
FACULDADE CIDADE VERDE;FCV;Maringá;41;PR
FACULDADE DE COMPUTAÇÃO DE MONTES CLAROS;FACOMP;Montes Claros;31;MG
FACULDADE EVANGÉLICA;FE;Brasília;53;DF
FACULDADE FILADÉLFIA;FAFIL;Ribeirão Preto;35;SP
FACULDADE DOM LUIS DE ORLEANS E BRAGANÇA;FARRP;Ribeira do Pombal;29;BA
SINAL - FACULDADE DE TEOLOGIA E FILOSOFIA;SINAL;Rio Branco;12;AC
FACULDADE PADRE DOURADO - FDR;FDR;Fortaleza;23;CE
INSTITUTO SUPERIOR DE EDUCAÇÃO DO MUNICÍPIO DE ITAPERUNA;ISEMI;Itaperuna;33;RJ
FUNDAÇÃO DE ENSINO SUPERIOR DE CLEVELÂNDIA;FESC;Clevelândia;41;PR
FACULDADES INTEGRADAS DO VALE DO IVAÍ;;Ivaiporã;41;PR
FACULDADE PEDRO II;FAPE2;Belo Horizonte;31;MG
FACULDADE DE TECNOLOGIA IPEP DE CAMPINAS;FATEC CAMPINAS;Campinas;35;SP
FACULDADE DE TECNOLOGIA IPEP DE SÃO PAULO;FATEC SP;São Paulo;35;SP
FACULDADE DE TECNOLOGIA SAINT PASTOUS;FSP;Porto Alegre;43;RS
FACULDADE ECOAR;FAECO;Passo Fundo;43;RS
ESCOLA SUPERIOR NACIONAL DE SEGUROS;ESNS;Rio de Janeiro;33;RJ
FACULDADE CIÊNCIAS DA VIDA;FCV;Sete Lagoas;31;MG
FACULDADE MARANHENSE SÃO JOSÉ DOS COCAIS;FSJ;Timon;21;MA
FACULDADE DE EDUCAÇÃO DE BACABAL - FEBAC;FEBAC;Bacabal;21;MA
FACULDADE DE TECNOLOGIA SÃO FRANCISCO;FATESF;Jacareí;35;SP
FACULDADE PAULISTA DE PESQUISA E ENSINO SUPERIOR;FAPPES;São Paulo;35;SP
FACULDADES INTEGRADAS DOM PEDRO II;DOMPEDRO;São José do Rio Preto;35;SP
FACULDADES INTEGRADAS ADVENTISTAS DE MINAS GERAIS;FADMINAS;Lavras;31;MG
FACULDADE DE ALMENARA;ALFA;Almenara;31;MG
FACULDADE SERRA DA MESA;FASEM;Uruaçu;52;GO
Faculdade SOCIESC;;Florianópolis;42;SC
Faculdade Itaboraí;;Itaboraí;33;RJ
FACULDADE IBGEN - INSTITUTO BRASILEIRO DE GESTÃO DE NEGÓCIOS;IBGEN;Porto Alegre;43;RS
FACULDADE MADRE TEREZA;FAMAT;Santana;16;AP
FACULDADE TEOLÓGICA BATISTA DE SÃO PAULO;FTBSP;São Paulo;35;SP
Faculdade IBGEN;IBGEN;Porto Alegre;43;RS
FACULDADE SÃO TOMAZ DE AQUINO;FSTA;Salvador;29;BA
INSTITUTO UVB.BR;IUVB;São Paulo;35;SP
INSTITUTO DE ENSINO SUPERIOR DE MATO GROSSO;IESMT;Cuiabá;51;MT
FACULDADE CURITIBANA;FAC;Curitiba;41;PR
FACULDADE DE ARACAJU;FACAR;Aracaju;28;SE
FACULDADE ESTÁCIO DE SANTO ANDRÉ;ESTÁCIO SANTO ANDRÉ;Santo André;35;SP
FACULDADE PARAENSE DE ENSINO;FAPEN;Belém;15;PA
INSTITUTO DE ENSINO SUPERIOR DO RIO GRANDE DO NORTE;IESRN;Natal;24;RN
INSTITUTO MARANHENSE DE ENSINO E CULTURA;IMEC;São Luís;21;MA
FACULDADE DE ENSINO DE MINAS GERAIS;FACEMG;Belo Horizonte;31;MG
FACULDADE DE ENSINO SUPERIOR DA AMAZÔNIA;FESAM;Macapá;16;AP
FACULDADE JUIZ DE FORA;FJF;Juiz de Fora;31;MG
FACULDADE EVANGÉLICA DE GOIANÉSIA;;Goianésia;52;GO
FACULDADE DE TECNOLOGIA ENSITEC;ENSITEC;Curitiba;41;PR
FACULDADE FRUTAL;FAF;Frutal;31;MG
FACULDADE GUAIRACÁ;FAG;Guarapuava;41;PR
FACULDADE JAUENSE;;Jaú;35;SP
FACULDADE SENAC PORTO ALEGRE - FSPOA;SENAC/RS;Porto Alegre;43;RS
FACULDADE DE TECNOLOGIA DA PARAÍBA;FATECPB;Cabedelo;25;PB
FACULDADE DE DIREITO DE ALTA FLORESTA;;Alta Floresta;51;MT
FACULDADE MAURÍCIO DE NASSAU DE JOÃO PESSOA;FMN JOÃO PESSOA;João Pessoa;25;PB
INSTITUTO DE EDUCAÇÃO SUPERIOR DE POUSO ALEGRE;FAPA;Pouso Alegre;31;MG
FACULDADE VASCO DA GAMA;FVG;Salvador;29;BA
FACULDADE ESTÁCIO DE JOÃO PESSOA - ESTÁCIO DE JOÃO PESSOA;ESTÁCIO DE JOÃO PESS;João Pessoa;25;PB
Faculdade IPEMED de Ciências Médicas;IPEMED;Belo Horizonte;31;MG
CENTRO UNIVERSITÁRIO FACVEST;FACVEST;Lages;42;SC
FACULDADE BAIANA DE DIREITO E GESTÃO;;Salvador;29;BA
FUNDAÇÃO UNIVERSIDADE FEDERAL DO TOCANTINS;UFT;Palmas;17;TO
FACULDADE MAURÍCIO DE NASSAU DE NATAL;FMN NATAL;Natal;24;RN
FACULDADE DAS ÁGUAS EMENDADAS - FAE;FAE;Brasília;53;DF
FACULDADE LUCIANO FEIJÃO;FLF;Sobral;23;CE
FACULDADE REGIONAL DE ALAGOINHAS;FARAL;Alagoinhas;29;BA
FACULDADE BRASILEIRA DE EDUCAÇÃO E CULTURA;FABEC BRASIL;Goiânia;52;GO
FACULDADE MAUÁ DE BRASÍLIA;MAUADF;Brasília;53;DF
INSTITUTO FLORENCE DE ENSINO SUPERIOR;IFES;São Luís;21;MA
Faculdade Projeção de Planaltina;FAPRO;Brasília;53;DF
CENTRO UNIVERSITÁRIO DA FUNDAÇÃO EDUCACIONAL GUAXUPÉ;UNIFEG;Guaxupé;31;MG
AVM - FACULDADE INTEGRADA;IAVM;Rio de Janeiro;33;RJ
FACULDADE BRASIL CENTRAL;FBC;Águas Lindas de Goiás;52;GO
FACULDADE DECISION DE NEGÓCIOS;FACULDADE DECISION;Porto Alegre;43;RS
FACULDADE MAURÍCIO DE NASSAU DE CAMPINA GRANDE;FMN CG;Campina Grande;25;PB
FACULDADE DE INTEGRAÇÃO DO SERTÃO;FIS;Serra Talhada;26;PE
FACULDADE MUNDIAL;;São Paulo;35;SP
FACULDADE DE TECNOLOGIA SENAI ROBERTO MANGE;FATEC SENAI RM;Anápolis;52;GO
FACULDADE ARNALDO HORÁCIO FERREIRA;FAAHF;Luís Eduardo Magalhães;29;BA
INSTITUTO DE EDUCAÇÃO SUPERIOR RAIMUNDO SÁ;IESRSA;Picos;22;PI
FACULDADE MÉTODO DE SÃO PAULO;FAMESP;São Paulo;35;SP
FACULDADE ANHANGUERA DE LIMEIRA;;Limeira;35;SP
Faculdade Anhanguera de Indaiatuba;;Indaiatuba;35;SP
FACULDADE ALIANÇA;;Itaberaí;52;GO
FACULDADE DE ENSINO SUPERIOR SANTA BARBARA;FAESB;Tatuí;35;SP
FACULDADE DE TECNOLOGIA SENAC TUBARÃO;SENAC;Tubarão;42;SC
FACULDADE DE TECNOLOGIA SENAC CHAPECÓ;SENAC;Chapecó;42;SC
FACULDADE DE TECNOLOGIA SENAC BLUMENAU;SENAC;Blumenau;42;SC
FACULDADE DE TECNOLOGIA LUIZ ADELAR SCHEUER;FATEC- JF;Juiz de Fora;31;MG
FACULDADE DE CIÊNCIAS JURÍDICAS E GERENCIAIS DE OLIVEIRA;FACIJUGO;Oliveira;31;MG
FACULDADES INTEGRADAS DE CATAGUASES;FIC;Cataguases;31;MG
FACULDADE DE TECNOLOGIA SENAI CIMATEC;SENAI CIMATEC;Salvador;29;BA
INSTITUTO SUPERIOR DE EDUCAÇÃO CARLOS CHAGAS;ISECC;Juiz de Fora;31;MG
CENTRO UNIVERSITÁRIO DE CARATINGA;UNEC;Caratinga;31;MG
CENTRO SUPERIOR DE ENSINO E PESQUISA DE MACHADO;CESEP;Machado;31;MG
UNIVERSIDADE DE RIO VERDE;FESURV;Rio Verde;52;GO
FACULDADE SÃO FRANCISCO DE PIUMHI;FASPI;Piumhi;31;MG
FACULDADE DE TECNOLOGIA DO AMAPÁ;META;Macapá;16;AP
FACULDADE DE TECNOLOGIA PENTÁGONO;FATEP;Santo André;35;SP
FACULDADE DE BAURU;-;Bauru;35;SP
FACULDADE JK - BRASÍLIA - UNIDADE PLANO PILOTO;CENACAP;Brasília;53;DF
FACULDADE DE TECNOLOGIA INTEGRAL;CETI;Curitiba;41;PR
CENTRO UNIVERSITÁRIO DE FORMIGA;UNIFORMG;Formiga;31;MG
FUNDAÇÃO UNIVERSIDADE FEDERAL DO VALE DO SÃO FRANCISCO;UNIVASF;Petrolina;26;PE
CENTRO UNIVERSITÁRIO SENAC;SENACSP;São Paulo;35;SP
FACULDADE INSTITUTO SUPERIOR DE EDUCAÇÃO DO PARANÁ - FAINSEP;FAINSEP;Maringá;41;PR
FACULDADE UNIÃO DE GOYAZES;FUG;Trindade;52;GO
FACULDADE ANHANGUERA DE TECNOLOGIA DE SÃO BERNARDO;FAT;São Bernardo do Campo;35;SP
FACULDADE DE TECNOLOGIA SÃO MATEUS;FATESM;Porto Velho;11;RO
FACULDADE JK - ASA NORTE;-;Brasília;53;DF
FACULDADE DE TECNOLOGIA CETEP;CETEP;Curitiba;41;PR
FACULDADE SENAC PERNAMBUCO;SENACPE;Recife;26;PE
INSTITUTO INFNET RIO DE JANEIRO;INFNET;Rio de Janeiro;33;RJ
FACULDADE DE ENSINO SUPERIOR DO INTERIOR PAULISTA;FAIP;Marília;35;SP
FACULDADE DE TECNOLOGIA SENAC PELOTAS;FATEC SENAC PELOTAS;Pelotas;43;RS
FATECE - FACULDADE DE TECNOLOGIA, CIÊNCIAS E EDUCAÇÃO;FATECE;Pirassununga;35;SP
FACULDADE DE TECNOLOGIA SENAC PASSO FUNDO;SENAC PASSO FUNDO;Passo Fundo;43;RS
FACULDADE DE TECNOLOGIA ESTÁCIO DE CURITIBA;FATEC ESTÁC CURITIBA;Curitiba;41;PR
CENTRO UNIVERSITÁRIO METODISTA;IPA;Porto Alegre;43;RS
FACULDADE ANHANGUERA DE RIO CLARO;;Rio Claro;35;SP
INSTITUTO NACIONAL DE EDUCAÇÃO DE SURDOS;INES;Rio de Janeiro;33;RJ
CENTRO UNIVERSITÁRIO PADRE ANCHIETA;UNIANCHIETA;Jundiaí;35;SP
FACULDADE DE TECNOLOGIA DE BOTUCATU;FATEC BT;Botucatu;35;SP
FACULDADE DE TECNOLOGIA DE GARÇA;FATECGA;Garça;35;SP
FACULDADE DE TECNOLOGIA DE JUNDIAÍ;FATEC/JD;Jundiaí;35;SP
FACULDADE DE TECNOLOGIA DE MAUÁ;FATEC MAUÁ;Mauá;35;SP
FACULDADE DE TECNOLOGIA DE MOCOCA;FATEC;Mococa;35;SP
FACULDADE DE TECNOLOGIA DE SÃO JOSÉ DO RIO PRETO;FATECRP;São José do Rio Preto;35;SP
FACULDADE DE TECNOLOGIA ZONA LESTE;FATEC-ZL;São Paulo;35;SP
FACULDADE DE ITAPECERICA DA SERRA;FIT;Itapecerica da Serra;35;SP
FACULDADE POLITEC;FAP;Santa Bárbara d'Oeste;35;SP
CENTRO UNIVERSITÁRIO FLUMINENSE;UNIFLU;Campos dos Goytacazes;33;RJ
FACULDADE DE TECNOLOGIA DE CATALÃO;FATECA;Catalão;52;GO
FACULDADE DE TECNOLOGIA INTENSIVA;FATECI;Fortaleza;23;CE
FACULDADE DO MEIO AMBIENTE E DE TECNOLOGIA DE NEGOCIOS;FAMATEC;Brasília;53;DF
FACULDADE TECNOLOGIA EDUVALE - AVARÉ;FATEC EDUVALE;Avaré;35;SP
Faculdade SOCIESC de Curitiba;SOCIESC;Curitiba;41;PR
FACULDADE DE CIÊNCIAS GERENCIAIS;;São Joaquim da Barra;35;SP
FACULDADE DE TECNOLOGIA FAMA;FAMA;Recife;26;PE
FACULDADE ICESP;ICESP;Brasília;53;DF
FACULDADE DE TECNOLOGIA DE GRAVATAÍ;FAQI;Gravataí;43;RS
FACULDADE TECNOLÓGICA INAP;FAT- INAP;Belo Horizonte;31;MG
FACULDADE DE TECNOLOGIA JARDIM;FATEJ;Santo André;35;SP
FACULDADE DE ROSEIRA;FARO;Roseira;35;SP
FACULDADE DE TECNOLOGIA PEDRO ROGÉRIO GARCIA;FATTEP;Concórdia;42;SC
FACULDADE DE TECNOLOGIA DE CURITIBA;FATEC-PR;Curitiba;41;PR
Faculdade Estácio da Paraíba;ESTÁCIO PARAÍBA;João Pessoa;25;PB
FACULDADE DE TECNOLOGIA EQUIPE DARWIN;FTED;Brasília;53;DF
FACULDADE DE TECNOLOGIA TECBRASIL - UNIDADE PORTO ALEGRE;Ftec Porto Alegre;Porto Alegre;43;RS
FACULDADE DE TECNOLOGIA TECBRASIL - UNIDADE BENTO GONÇALVES;Ftec Bento Gonçalves;Bento Gonçalves;43;RS
INSTITUTO FEDERAL DE EDUCAÇÃO, CIÊNCIA E TECNOLOGIA FARROUPILHA;IFFarroupilha;Santa Maria;43;RS
FACULDADE DE TECNOLOGIA SENAI ÍTALO BOLOGNA;FATECIB;Goiânia;52;GO
FACULDADE DE TECNOLOGIA SENAI DE DESENVOLVIMENTO GERENCIAL;FATESG;Goiânia;52;GO
ESCOLA SUPERIOR DE ENGENHARIA E GESTÃO DE SÃO PAULO - ESEG;ESEG;São Paulo;35;SP
FACULDADE DE TECNOLOGIA SENAI PORTO ALEGRE;FATEC SENAI;Porto Alegre;43;RS
INSTITUTO CATÓLICO DE ESTUDOS SUPERIORES DO PIAUÍ;ICESPI;Teresina;22;PI
FACULDADE DE CERES;FACER;Ceres;52;GO
FACULDADE JOAQUIM NABUCO - PAULISTA;FJN;Paulista;26;PE
FACULDADE MAURÍCIO DE NASSAU DE ARACAJU;;Aracaju;28;SE
FACULDADE JATAIENSE;FAJA;Jataí;52;GO
FACULDADE DE CIÊNCIAS SOCIAIS APLICADAS E DE TECNOLOGIAS DE AGUA BOA;FACESA;Água Boa;51;MT
Faculdade Maurício de Nassau Manaus;;Manaus;13;AM
FACULDADE ANHANGUERA DE SANTA BÁRBARA;;Santa Bárbara d'Oeste;35;SP
FACULDADE ANHANGUERA DE TAUBATÉ;;Taubaté;35;SP
FACULDADE DE TECNOLOGIA SENAI SÃO JOSÉ;SENAISC;São José;42;SC
FACULDADE DE TECNOLOGIA SENAI ITAJAÍ;FATEC SENAI ITAJAÍ;Itajaí;42;SC
FACULDADE DE TECNOLOGIA DE PIRACICABA;FATEP;Piracicaba;35;SP
FACULDADE JOAQUIM NABUCO RECIFE;FJN;Recife;26;PE
FACULDADE METROPOLITANA DE RIO DO SUL;FAMESUL;Rio do Sul;42;SC
FACULDADE DE TECNOLOGIA SENAC GOIÁS;;Goiânia;52;GO
CENTRO UNIVERSITÁRIO BARRIGA VERDE;UNIBAVE;Orleans;42;SC
CENTRO DE ENSINO SUPERIOR DE UBERABA;CESUBE;Uberaba;31;MG
FACULDADE NOSSA CIDADE;FNC;Carapicuíba;35;SP
FACULDADE JK DE TECNOLOGIA;FACJK;Brasília;53;DF
FACULDADE NAZARENA DO BRASIL;FNB;Campinas;35;SP
FACULDADE PERUIBE;FPBE;Peruíbe;35;SP
FACULDADE ALIANÇA;FACE;Teresina;22;PI
FACULDADE MINEIRENSE;FAMA;Mineiros;52;GO
FACULDADE DE TECNOLOGIA ROGACIONISTA;ROGA;Brasília;53;DF
FACULDADE DE ENSINO SUPERIOR DO NORDESTE;FAESNE;João Pessoa;25;PB
FACULDADE DE TECNOLOGIA CÉSAR LATTES;;Itu;35;SP
Faculdade ESAMC São Paulo - ESAMC;ESAMC;São Paulo;35;SP
FACULDADE PEDRO LEOPOLDO;FPL;Pedro Leopoldo;31;MG
INSTITUTO SUPERIOR DE EDUCAÇÃO PROFESSORA NAIR FORTES ABU-MERHY;ISEFOR;Além Paraíba;31;MG
FACULDADE PITÁGORAS DE TECNOLOGIA DE BELO HORIZONTE;PIT-FATEC;Belo Horizonte;31;MG
FACULDADES INTEGRADAS DE CACOAL;UNESC;Cacoal;11;RO
FACULDADES INTEGRADAS PITÁGORAS;FIP-MOC;Montes Claros;31;MG
INSTITUTO DE FILOSOFIA E TEOLOGIA DE GOIÁS;IFITEG;Goiânia;52;GO
FACULDADE DE INHUMAS - FAC-MAIS;FACMAIS;Inhumas;52;GO
FACULDADE DE TECNOLOGIA DE PORTO ALEGRE;FAQI;Porto Alegre;43;RS
FACULDADE ESTÁCIO DO AMAZONAS - ESTÁCIO AMAZONAS;ESTÁCIO AMAZONAS;Manaus;13;AM
FACULDADE DO VALE ELVIRA DAYRELL - FAVED;FAVED;Virginópolis;31;MG
FACULDADE INTEGRAÇÃO TIETE;FIT;Tietê;35;SP
FACULDADE DE TECNOLOGIA SENAC JARAGUÁ DO SUL;;Jaraguá do Sul;42;SC
FACULDADE DE TECNOLOGIA SENAI CETIND;;Lauro de Freitas;29;BA
FACULDADE DO CENTRO EDUCACIONAL MINEIRO - FACEM;FACEM-BH;Belo Horizonte;31;MG
FACULDADE DE TECNOLOGIA AMÉRICA DO SUL;;Maringá;41;PR
FACULDADE DE TECNOLOGIA DE PALMAS;FTP;Palmas;17;TO
FACULDADE DE CIÊNCIAS SOCIAIS DOS PALMARES;FACIP;Palmares;26;PE
FACULDADE DE TECNOLOGIA ÁLVARES DE AZEVEDO;FAATESP;São Paulo;35;SP
INSTITUTO FEDERAL DE EDUCAÇÃO, CIÊNCIA E TECNOLOGIA DO SUL DE MINAS GERAIS;IF SUL DE MINAS;Pouso Alegre;31;MG
FACULDADE PITÁGORAS DE BETIM;PITÁGORAS-BETIM;Betim;31;MG
FACULDADE TERRA NORDESTE;FATENE;Caucaia;23;CE
CENTRO UNIVERSITÁRIO DE MINEIROS;UNIFIMES;Mineiros;52;GO
FACULDADE DE BALSAS;UNIBALSAS;Balsas;21;MA
FACULDADE PANAMERICANA DE JI-PARANÁ;;Ji-Paraná;11;RO
FACULDADE JK - UNIDADE I - GAMA;;Brasília;53;DF
FACULDADES INTEGRADAS BARROS MELO;FIBAM;Olinda;26;PE
FACULDADE DE TECNOLOGIA SENAI BELO HORIZONTE;FATEC SENAI BH;Belo Horizonte;31;MG
FACULDADE PROFESSOR MIGUEL ÂNGELO DA SILVA SANTOS;FEMASS;Macaé;33;RJ
FACULDADE UNIGRAN CAPITAL;UNIGRAN CAPITAL;Campo Grande;50;MS
FACULDADE DE ENFERMAGEM NOVA ESPERANÇA DE MOSSORÓ - FACENE/RN;FACENE/RN;Mossoró;24;RN
ESCOLA SUPERIOR PAULISTA DE ADMINISTRAÇÃO - ESPA;ESPA;Guarulhos;35;SP
FACULDADE RIO CLARO;;Ijuí;43;RS
FACULDADE CIDADE DE GUANHÃES - FACIG;FACIG;Guanhães;31;MG
FACULDADE METROPOLITANA DA AMAZÔNIA;FAMAZ;Belém;15;PA
FACULDADE METROPOLITANA DE MARABÁ;METROPOLITANA;Marabá;15;PA
FACULDADE DOM PEDRO II DE TECNOLOGIA;FAB;Salvador;29;BA
FACULDADE PASCHOAL DANTAS;FPD;São Paulo;35;SP
FACULDADE ANHANGUERA JARAGUÁ DO SUL;FATEJA;Jaraguá do Sul;42;SC
FACULDADE DE TECNOLOGIA DO VALE DO IVAÍ;FATEC-IVAI;Ivaiporã;41;PR
FACULDADES INTEGRADAS CAMPO-GRANDENSES;FIC;Rio de Janeiro;33;RJ
UNIVERSIDADE FEDERAL DO RECÔNCAVO DA BAHIA;UFRB;Cruz das Almas;29;BA
FUNDAÇÃO UNIVERSIDADE FEDERAL DA GRANDE DOURADOS;UFGD;Dourados;50;MS
FACULDADE REGIONAL PALMITOS;FAP;Palmitos;42;SC
CENTRO UNIVERSITÁRIO CATÓLICO SALESIANO AUXILIUM;UNISALESIANO;Lins;35;SP
CENTRO UNIVERSITÁRIO TIRADENTES;FITS;Maceió;27;AL
FACULDADE ADVENTISTA DA BAHIA;FADBA;Cachoeira;29;BA
FACULDADE DE TECNOLOGIA SENAI CAMPO GRANDE;;Campo Grande;50;MS
FACULDADE SÃO FRANCISCO DA PARAÍBA;FASP;Cajazeiras;25;PB
FACULDADE HERRERO;FATEC;Curitiba;41;PR
ESTÁCIO FATERN - FACULDADE ESTÁCIO DO RIO GRANDE DO NORTE;ESTÁCIO FATERN;Natal;24;RN
FACULDADE CENTRO MATO-GROSSENSE;;Sorriso;51;MT
FACULDADE DE TECNOLOGIA MACHADO DE ASSIS;FAMA;Curitiba;41;PR
FACULDADE DO NORTE GOIANO;FNG;Porangatu;52;GO
FACULDADE APOGEU;APOGEU;Brasília;53;DF
FACULDADE DE TECNOLOGIA FATEP;FATEP;Rio Claro;35;SP
FACULDADE DE OURO PRETO DO OESTE;UNEOURO;Ouro Preto do Oeste;11;RO
FACULDADE CATÓLICA DE RONDONIA;FCR;Porto Velho;11;RO
FACULDADE REGES DE RIBEIRÃO PRETO;;Ribeirão Preto;35;SP
FACULDADE DE CIÊNCIAS GERENCIAIS EM VOTUPORANGA;;Votuporanga;35;SP
FACULDADE DE CIÊNCIAS GERENCIAIS BARÃO DE JUNDIAÍ;FCG;Jundiaí;35;SP
FACULDADE DE ENSINO SUPERIOR KM 125;;Cornélio Procópio;41;PR
FACULDADE DE TECNOLOGIA ASSESSORITEC;;Joinville;42;SC
FACULDADE DE EDUCAÇÃO E MEIO AMBIENTE;FAEMA;Ariquemes;11;RO
FACULDADE ANHANGUERA DE CAXIAS DO SUL;FACS;Caxias do Sul;43;RS
FACULDADE DE TECNOLOGIA TECMED;TECMED;São José do Rio Preto;35;SP
FACULDADE ANGLO-AMERICANO DE JOÃO PESSOA;FAAJP;João Pessoa;25;PB
FACULDADE ANGLO-AMERICANO DE CAXIAS DO SUL;FAACS;Caxias do Sul;43;RS
FACULDADE DO PLANALTO;;Passo Fundo;43;RS
FACULDADE ANHANGÜERA DE SÃO JOSÉ;;São José dos Campos;35;SP
FACULDADE ANHANGÜERA DE SOROCABA;FSO;Sorocaba;35;SP
FACULDADE ANHANGÜERA DE PIRACICABA;;Piracicaba;35;SP
FACULDADE DE AGRONEGÓCIO PARAÍSO DO NORTE;FAPAN;Paraíso do Norte;41;PR
FACULDADE DELTA;FACULDADE DELTA;Goiânia;52;GO
Instituto Superior de Ciencias Policiais;ISCP;Brasília;53;DF
Faculdade Gran Tietê;FGT;Barra Bonita;35;SP
Faculdade de Tecnologia de Carapicuiba;FATEC;Carapicuíba;35;SP
Faculdade de Tecnologia de Catanduva;FATEC Catanduva;Catanduva;35;SP
FACULDADE PESTALOZZI DE FRANCA;FPF;Franca;35;SP
FACULDADE DUARTE COELHO;FDC;Surubim;26;PE
Faculdade do Bico do Papagaio;FABIC;Augustinópolis;17;TO
Faculdade Rio Sono;riso;Pedro Afonso;17;TO
Faculdade Mário Quintana;FAMAQUI;Porto Alegre;43;RS
Faculdade Cultura Inglesa;FCI;São Paulo;35;SP
Faculdade Para o Desenvolvimento do Sudeste Tocantinense;FADES;Dianópolis;17;TO
FACULDADE DEVRY DE SÃO LUÍS;;São Luís;21;MA
FACULDADE DE EDUCAÇÃO E TECNOLOGIA DA AMAZÔNIA;FAM;Abaetetuba;15;PA
INSTITUTO EDUCATIE;EDUCATIE;São Paulo;35;SP
Faculdade Leonardo da Vinci - Santa Catarina;;Timbó;42;SC
Faculdade Melies de Tecnologia;Melies;São Paulo;35;SP
Faculdade Talles de Mileto;;Parnamirim;24;RN
FACULDADE SENAI RIO;;Rio de Janeiro;33;RJ
CENTRO SUPERIOR DE ESTUDOS JURÍDICOS CARLOS DRUMMOND DE ANDRADE;CSEJCDA;São Paulo;35;SP
Faculdade do Norte de Mato Grosso;AJES;Guarantã do Norte;51;MT
Centro Universitário - Católica de Santa Catarina em Joinville;Católica em Joinvile;Joinville;42;SC
FACULDADE UNILAGOS;UNILAGOS;Mangueirinha;41;PR
Faculdade Brasileira de Tributação;FBT;Porto Alegre;43;RS
